title,preview
NASA's Briefcase-Size MarCO Satellite Picks Up Honors,"The twin spacecraft, the first of their kind to fly into deep space, earn a Laureate from Aviation Week & Space Technology."
NASA's Curiosity Takes Selfie With 'Mary Anning' on the Red Planet,The Mars rover has drilled three samples of rock in this clay-enriched region since arriving in July.
Join NASA for the Launch of the Mars 2020 Perseverance Rover,"No matter where you live, choose from a menu of activities to join NASA as we ""Countdown to Mars"" and launch the Perseverance rover to the Red Planet."
"What's Mars Solar Conjunction, and Why Does It Matter?","NASA spacecraft at Mars are going to be on their own for a few weeks when the Sun comes between Mars and Earth, interrupting communications."
NASA's Mars Helicopter Attached to Mars 2020 Rover ,The helicopter will be first aircraft to perform flight tests on another planet.
NASA's Curiosity Mars Rover Snaps Its Highest-Resolution Panorama Yet,"To go along with the stunning 1.8-billion-pixel image, a new video offers a sweeping view of the Red Planet."
Common Questions about InSight's 'Mole',"The following Q&As with members of the team answer some of the most common questions about the burrowing device, part of a science instrument called the Heat Flow and Physical Properties Package (HP3)."
NASA's Treasure Map for Water Ice on Mars,"A new study identifies frozen water just below the Martian surface, where astronauts could easily dig it up."
NASA's Perseverance Rover Will Peer Beneath Mars' Surface ,The agency's newest rover will use the first ground-penetrating radar instrument on the Martian surface to help search for signs of past microbial life. 
Naming a NASA Mars Rover Can Change Your Life,Want to name the robotic scientist NASA is sending to Mars in 2020? The student who named Curiosity — the rover currently exploring Mars — will tell you this is an opportunity worth taking.
"The Launch Is Approaching for NASA's Next Mars Rover, Perseverance",The Red Planet's surface has been visited by eight NASA spacecraft. The ninth will be the first that includes a roundtrip ticket in its flight plan. 
NASA-JPL Names 'Rolling Stones Rock' on Mars,NASA's Mars InSight mission honored one of the biggest bands of all time at Pasadena concert.
NASA's Mars 2020 Rover Completes Its First Drive,"In a 10-plus-hour marathon, the rover steered, turned and drove in 3-foot (1-meter) increments over small ramps."
InSight's 'Mole' Team Peers into the Pit,Efforts to save the heat probe continue.
NASA's Perseverance Rover 100 Days Out,"Mark your calendars: The agency's latest rover has only about 8,640,000 seconds to go before it touches down on the Red Planet, becoming history's next Mars car."
